Numéro,Titre,Auteur(s),Ville(s)
Mémoire N°62,"Paul Michel, photographe  ",Jean Huyghe ,L'Oisans
Mémoire N°62,Les élèves découvrent Vizille - Le château du Roi  ,- ,Vizille
Mémoire N°62,Les élèves découvrent Vizille - Notre Mairie  ,Rémi Riolan ,Vizille
Mémoire N°62,Mathématiques et chemins de fer (ou René Thom sur le petit train de La Mure] (-  ,Jacques Gasqui ,Matheysine
Mémoire N°62,Mathématiques et chemins de fer (ou René Thom sur le petit train de La Mure] (-  ,Jacques Gasqui ,Vizille
Mémoire N°62,La maison de Petichet  ,"- ,  Evelyne Dress ",Matheysine
Mémoire N°62,Raconte-moi Allemond  ,Pierrette Tournier ,Allemond (38114)
Mémoire N°62,Ambiance à Vaulnaveys (  ,Pierre Coing Boyat ,Vaulnaveys le haut
Mémoire N°62,Les ascensions oubliées des officiers géographes (1748-1778) ,"Olivier Joseph ,  Paul Billon-grand ",L'Oisans
Mémoire N°62,Le prieuré de Vizille en BD  ,Pierre Martin ,Vizille
Mémoire N°62,Le prieuré de Vizille en BD  ,Georges Martin ,Vizille
Mémoire N°62,La Pierre des Rois (suite)  ,Georges Martin ,Saint Pierre de Mésage
Mémoire N°62,Pour en savoir plus - Une promenade dans les salles du Louvre ,Denis Bellon ,Pays vizillois
Mémoire N°62,L'histoire discrète de l'église Saint-Antoine de Livet  ,Caroline Guérin ,Livet et Gavet
Mémoire N°62,Le travail textile à Vizille  ,Quentin Jagadzinskil ,Vizille
Mémoire N°62,Vieille-Morte - Des logis et des écuries ? Des ruines...  ,Nathalie POIRET ,L'Oisans
Mémoire N°62,Les déplacements de Jean Jaurès en région « Rhône-Alpes » () ,Catherine Moulin ,Vizille
Mémoire N°62,Les déplacements de Jean Jaurès en région «Rhône-Alpes» - 2ème partie  ,- ,Vizille
Mémoire n°63,Éditorial  ,Denis Bellon ,Pays vizillois
Mémoire n°63,Éditorial  ,Denis Bellon ,Vizille
Mémoire n°63,L'ancien canton de Vizille de la préhistoire à l'AN MIL  ,Jean-Claude Michel ,Pays vizillois
Mémoire n°63,L'ancien canton de Vizille de la préhistoire à l'AN MIL  ,Jean-Claude Michel ,Vizille
Mémoire n°63,La « Fontaine puant » au hameau des Essoulieux (commune du Bourg d'Oisans)  ,Nathalie Poiret ,Bourg d'Oisans
Mémoire n°63,Le dernier train  -  ,Denis Bellon ,Pays vizillois
Mémoire n°63,Le dernier train  -  ,Denis Bellon ,Vizille
Mémoire n°63,Les mémoires de Carmen Saunier  ,Carmen Saunier ,Pays vizillois
Mémoire n°63,Les mémoires de Carmen Saunier  ,Carmen Saunier ,Vizille
Mémoire n°63,Les mémoires de Carmen Saunier  ,Carmen Saunier ,Bourg d'Oisans
Mémoire n°63,Les Gourlus  ,Claudie Picot ,Vizille
Mémoire n°63,Le prieuré de Vizille en BD  ,Georges Martin ,Vizille
Mémoire n°63,L'histoire du château de Cornage de Lesdiguières à nos jours  ,"Gérard Mingat , Gilles Rey ",Vizille
Mémoire n°63,Bon Repos - Grandeur et décadence ou les misères d'un château ,Pierre Coing Boyat ,Jarrie
Mémoire n°63,"L'Académie Delphinale, 250 ans d'histoire et de mémoire en Dauphiné ",Denis Bellon ,Isère
Mémoire n°63,1982 - Les Trois Mousquetaires - Louis Beyler Le Festival de Vizille fête ses 10 ans...  ,Jeannette Della-Vedova ,Vizille
Mémoire n°63,"Casimir, André, Gérard Berthon et le rugby  ",Jeannette Della-Vedova ,Vizille
Mémoire n°63,Balade vizilloise au fil des panneaux  ,Pierrette Tournier ,Vizille
Mémoire n°64,Éditorial  ,Denis Bellon ,Vizille
Mémoire n°64,Le cahier de route de Charvet  ,Pierrette Tournier ,Vizille
Mémoire n°64,Le tram ne viendra plus sur la place  ,Denis Bellon ,Vizille
Mémoire n°64,Ils eurent leur temps de célébrité...! maintenant nos vieux trams tombent sous les coups des démolisseurs  ,Aimé Mollard ,Vizille
Mémoire n°64,Le petit train départemental des V.F.D. a fait son dernier voyage  ,Denis Bellon ,Vizille
Mémoire n°64,Le petit train départemental des V.F.D. a fait son dernier voyage  ,Denis Bellon ,Bourg d'Oisans
Mémoire n°64,Des locomotives au pied des Alpes - De la gare Jarrie-Vizille à la gare  ,Pascal Reinhard ,Jarrie
Mémoire n°64,Des locomotives au pied des Alpes - De la gare Jarrie-Vizille à la gare  ,Pascal Reinhard ,Vizille
Mémoire n°64,Champagne à Brié - Mont-Rolland  ,"Pierre Coing Boyat , Denise Rostaing ",Jarrie
Mémoire n°64,Le prieuré de Vizille en BD  ,Georges Martin ,Vizille
Mémoire n°64,1979 - Ah ! Si Arthur était là... Le Vilème festival de Vizille  ,Jeannette Della-Vedova ,Vizille
Mémoire n°64,Histoire de la famille Brun - Du rouleau à pâtisserie au rouleau compresseur !  - ,Jean-Louis Philip ,Vizille
Mémoire n°64,Les facteurs ruraux du Pays Vizillois sous le Second Empire  ,Jacques Gasqui ,Vizille
Mémoire n°64,Les facteurs ruraux du Pays Vizillois sous le Second Empire  ,Jacques Gasqui ,Canton (38220)
Mémoire n°64,Le centre d'apprentissage bilan d'une année de travail - 14 juillet 1952  ,Denis Bellon ,Vizille
Mémoire n°64,Jean Seyer (Surville nom de code dans la Résistance) un Lorrain au maquis de l'Disans  ,Denis Bellon ,Vizille
Mémoire n°64,Essai sur l'histoire minière et minéralogique des anciennes mines de fer de la commune de Saint-Pierre de Mésage  ,- ,Saint Pierre de Mésage
Mémoire n°65,Éditorial  ,Denis Bellon ,Vizille
Mémoire n°65,"La recherche historique, une histoire à rebondissements  ",Pierre Coing Boyat ,Canton (38220)
Mémoire n°65,La centrale hydroélectrique des Vernes - Une histoire remarquable  ,Marie-Christine Bailly-Maitre - ,Séchilienne
Mémoire n°65,La centrale hydroélectrique des Vernes - Une histoire remarquable  ,Marie-Christine Bailly-Maitre - ,Livet et Gavet
Mémoire n°65,La centrale hydroélectrique des Vernes - Une histoire remarquable  ,Marie-Christine Bailly-Maitre - ,Rioupéroux
Mémoire n°65,Les édifices religieux de l'ancien canton de Vizille - fère partie ,Jean-Claude Michel ,Canton (38220)
Mémoire n°65,La remplaçante  ,Collectif - les Amis de l'Histoire ,Vizille
Mémoire n°65,La poésie du jour par l'intelligence artificielle sur Vizille  ,Roland Mastrorillo ,Vizille
Mémoire n°65,Symphonie lacustre - Les lacs du Dauphiné - fère partie  ,Thierry Grand ,Laffrey
Mémoire n°65,Symphonie lacustre - Les lacs du Dauphiné - fère partie  ,Thierry Grand ,L'Oisans
Mémoire n°65,Symphonie lacustre - Les lacs du Dauphiné - fère partie  ,Thierry Grand ,Canton (38220)
Mémoire n°65,Parrainage des tuyaux d'orgue  ,Daniel Blanc-Gonnet ,Vizille
Mémoire n°65,Symphonie lacustre - Les lacs du Dauphiné (suite)  ,Thierry Grand ,Massif de Belledonne
Mémoire n°65,Symphonie lacustre - Les lacs du Dauphiné (suite)  ,Thierry Grand ,L'Oisans
Mémoire n°65,Maurice Gaillard  ,Bernard Tixier ,Vizille
Mémoire n°65,L'histoire dans les archives communales - Le vingt-quatrième des pauvres  ,Pierre Coing Boyat ,Canton (38220)
Mémoire n°65,Souvenirs de Mohamed Boumeghra  ,Jeannette Della-Vedova ,Vizille
Mémoire n°65,Les vingt ans de l'association des amis de la chapelle  ,- ,Vizille
Mémoire n°65,La chapelle Saint-Barthélemy à Sersigaud  ,Paul Schwoerer ,Matheysine
Mémoire n°65,Vizille demain  ,Denis Bellon ,Vizille
Mémoire n°66,40000€ pour le prieuré de Vizille  ,Denis Bellon ,Vizille
Mémoire n°66,Éditorial  ,- ,Pays vizillois
Mémoire n°66,L'ancien diocèse de Grenoble et son art roman - Le Pays Vizillois  ,Apolinne Troyes ,Pays vizillois
Mémoire n°66,Bâtiments et monuments que la pierre a bâtis !  ,Thierry Grand ,Pays vizillois
Mémoire n°66,Les édifices religieux de l'ancien canton de Vizille - 2ème partie  ,Jean-Claude Michel ,Pays vizillois
Mémoire n°66,La remplaçante (suite)  ,- ,Pays vizillois
Mémoire n°66,La poésie du jour 0 par l'intelligence artificielle sur Vizille ,- ,Vizille
Mémoire n°66,les mines de l’hermine  ,Marie-Christine Bailly-Maitre - ,L'Oisans
Mémoire n°66,les mines de l’hermine  ,Marie-Christine Bailly-Maitre - ,L'Alpe d'Huez
Mémoire n°66,Lucie Baud a enfin son école à Saint-Pierre de Mésage ,Denis Bellon ,Saint Pierre de Mésage
Mémoire n°66,Le tremplin de Saint-Nizier  ,Denis Bellon ,Grenoble
Mémoire n°66,Cérémonie du 11 novembre 2023  ,Pierrette Tournier ,Pays vizillois
Mémoire n°66,Cérémonie du 11 novembre 2023  ,Pierrette Tournier ,Vizille
Mémoire n°66,Rencontre à Séchilienne  ,Bernard Ycart ,Pays vizillois
Mémoire n°66,Et si on parlait BD ?  ,Georges Martin ,Pays vizillois
Mémoire n°67,Éditorial  ,Denis Bellon ,Pays vizillois
Mémoire n°67,Les papeteries de Vizille - Une histoire de familles,Gérard Coste,Vizille
Mémoire n°67,Château de Maupertuis dit Château d'Hugues,Pierre Coing Boyat ,Jarrie
Mémoire n°67,Le chemin de croix de Luc Barbier à l'église de Vizille,Michel Merlin - Michel Vallon,Vizille
