Numéro,Titre,Auteur(s),Ville(s)
Mémoire n°48,Uriage-les-Bains - Hôpital militaire complémentaire n°42 (1914-1919)  ,Charles Paillet ,Uriage
Mémoire n°48,Le mystère de Saint Firmin ou la légende de la cloche à la sauge  ,Claude Ferradou ,Notre Dame de Mésage
Mémoire n°48,Les belles années des corsos à Vizille - les années 80 (suite)  ,Jeannette Della-Vedova ,Vizille
Mémoire n°49,"Histoire d'un résistant un peu spécial : Jean Freysselinard , le gendre du président Albert Lebrun à Vizille  ",Eric Freysselinard ,Villeneuve d'Uriage
Mémoire n°49,la SAMA Société Anonyme des Meles artificielles  ,Denis Bellon ,Vizille
Mémoire n°49,Souvenirs au fil des saisons  ,Marie Del Net ,Vizille
Mémoire n°49,La Grande Guerre de 1914-1918 : Vizille et ses soldats décédés entre le 1er juillet et le 31 décembre 1915  ,"Daniel Blanc-Gonnet ,  Marie-Claude Argoud ",Vizille
Mémoire n°49,Les quatrièmes grand rendez-vous de l'histoire du Pays Vizillois : mai/juin 2016 ,Denis Bellon ,Vizille
Mémoire n°49,L'hôpital temporaire de La Valentine  ,Pierre Coing Boyat ,Jarrie
Mémoire n°49,Vizille et sa piscine  ,Danielle Amar ,Vizille
Mémoire n°49,Le centre d'apprentissage de Vizille  ,Pierre Draï ,Vizille
Mémoire n°49,Les eaux d'Uriage : des Thermes romains à l'entreprise industrielle : 2000 ans d'histoire  ,Charles Paillet ,Uriage
Mémoire n°49,Histoire courte des cordiers de Vizille  ,Patrice Dore ,Vizille
Mémoire n°49,ElirViallet capitaine de chasseurs alpins ; Août 1914- Juin 1915  ,Jacques Gasqui ,Saint Georges de Commiers
Mémoire n°49,Raoul Naz  ,Raoul Naz ,Vizille
Mémoire n°49,L'orgue de Vizille  ,Raoul Naz ,Vizille
Mémoire n°49,"1799, l'exode du Pape Pie VI et son passage à Vizille  ",Gilbert Gacon ,Isère
Mémoire n°49,"1799, l'exode du Pape Pie VI et son passage à Vizille  ",Gilbert Gacon ,Vizille
Mémoire n°49,Les belles années des corsos ; les années 1990  ,Jeannette Della-Vedova ,Vizille
Mémoire n°49,"Vizille et ses commerces: Désiré Trouillon, marchand de vin  ",Pierre Trouillon ,Vizille
Mémoire n°49,Jean Guitton 1917-2015  ,"Gérard Mingat ,  Marie Del Net ",Vaulnaveys le haut
Mémoire n°49,La page des poètes : Moi Connétable  ,Pierre Fiat ,Vizille
Mémoire n°49,Une des trois grandes usines de tissage de Vizille  ,- ,Vizille
Mémoire n°49,La page des jeux  ,Pierre Fiat ,Vizille
Mémoire n°50,Morts pour la France  ,Denis Bellon ,Vizille
Mémoire n°50,Compte rendu de la mobilisation à Vizille (1er août 1914)  ,Denis Bellon ,Vizille
Mémoire n°50,La grande guerre de 1914-1918 . Vizille et ses soldats décédés entre le 1er janvier et le 30 juin 1906  ,Marie-Claude Argoud ,Vizille
Mémoire n°50,François-Joseph Durand mort pour la France  ,Denis Bellon ,Vizille
Mémoire n°50,Gabriel Fiat Carnets de guerre - 1914-1918  ,Gabriel Fiat ,Séchilienne
Mémoire n°50,M. l'abbé Biard  ,Transcription ,Vizille
Mémoire n°50,Saint-Georges-de-Commiers . Morts pour la France pendant la grande guerre ,Jacques Gasqui ,Saint Georges de Commiers
Mémoire n°50,"Pour de vrais ""poilus""  ",Raoul Naz ,Verdun
Mémoire n°50,"L'histoire des Clavel, bourreliers à Vizille, place du château  ",Marie-Claude Argoud ,Vizille
Mémoire n°50,"Vizille et ses commerces ; Place de la Libération, Place du château 1ère partie ",Jeannette Della-Vedova ,Vizille
Mémoire n°50,Elles se souviennent et elles racontent  ,Yvette Bonnaire ,Vizille
Mémoire n°50,"Hier, le chemin de fer  ",Aliette Viard ,Jarrie
Mémoire n°50,"Hier, le chemin de fer  ",Aliette Viard ,Vizille
Mémoire n°50,"Hier, le chemin de fer  ",Aliette Viard ,L'Oisans
Mémoire n°50,Mon premier club sportif  ,Pierre Martin ,Vizille
Mémoire n°50,Théâtre d'antan La muette de Vizille  ,Pierre Fiat ,Lyon
Mémoire n°51,Heureux 25 ans  ,Denis Bellon ,Pays vizillois
Mémoire n°51,En amont du spectacle - l'écriture  ,Pierrette Tournier ,Pays vizillois
Mémoire n°51,Mémoires ouvrières - Le spectacle - La compagnie Partage  ,Pierrette Tournier ,Vizille
Mémoire n°51,Les industries de Vizille  ,Denis Bellon ,Vizille
Mémoire n°51,Brèves d'archives - Pour le renom de la ville: la propreté  ,Paul Fournier ,Vizille
Mémoire n°51,Accidents industriels en Pays Vizillois  ,Pierre Fiat ,Pays vizillois
Mémoire n°51,La grande guerre de 1914-1918 - Vizille et ses soldats décédés entre le 1er juillet et le 31 décembre 1916  ,Marie-Claude Argoud ,Vizille
Mémoire n°51,Transports Paul Vallet  ,Alain Romestant ,Vizille
Mémoire n°51,Vizille et ses commerces - Place de la Libération/Place du Château - 2ème partie  ,Jeannette Della-Vedova ,Vizille
Mémoire n°51,Les quatrièmes grands rendez-vous de l'histoire du Pays Vizillois  ,Denis Bellon ,Vizille
Mémoire n°51,Inauguration de l'orgue de Vizille le dimanche 26 novembre 1899  ,Daniel Blanc-Gonnet ,Vizille
Mémoire n°51,Le protonotaire et le curé de Vizille  ,Denis Bellon ,Vizille
Mémoire n°51,L'orgue de Vizille  ,Transcription ,Vizille
Mémoire n°52,"Guy Delahaye , photographe  ",Denis Bellon ,Vizille
Mémoire n°52,"2017,Année Lesdiguières  ",Denis Bellon ,Vizille
Mémoire n°52,Vizille et le festival 1973/ 1988 ; Le Diable et le Capitaine -1983  ,"Robert Aillaud ,  Jeannette Della-Vedova ",Vizille
Mémoire n°52,A la rencontre de François de Bonne  ,Pierrette Tournier ,Vizille
Mémoire n°52,Marie Vignon seconde femme du connétable  ,Marie-Claude Argoud ,Vizille
Mémoire n°52,Les ancêtres de Lesdiguières  ,Jeannette Della-Vedova ,Vizille
Mémoire n°52,"Chronologie de la vie de François de Bonne, Duc de Lesdiguières  ",Marie-Claude Argoud ,Vizille
Mémoire n°52,Le pont Lesdiguières à Claix  ,Pierre Fiat ,Claix
Mémoire n°52,"La prise du Château de Champ, du Pont de Cognet, du Château du Monestier  ",Marie-Claude Argoud ,Isère
Mémoire n°52,Une épouvantable défaite-1587 : la bataille de Jarrie vue du côté suisse  ,Guy Le Comte ,Jarrie
Mémoire n°52,"Les enfants et notre patrimoine : le Château, les arts  ",Jocelyne BELLON ,Vizille
Mémoire n°52,La Grande Guerre de 1914-1918 : Vizille et ses soldats décédés entre le 1er Janvier et le 30 juin 1917  ,Marie-Claude Argoud ,Vizille
Mémoire n°52,Notre chère Annie  ,Pierre Coing Boyat ,Vizille
Mémoire n°52,Vizille et ses commerces : Place de la Libération / Place du Château - 3ème partie ,Jeannette Della-Vedova ,Vizille
Mémoire n°52,Les pages des jeux : Lesdiguières  ,Pierre Fiat ,Vizille
Mémoire n°52,Un orgue historique à restaurer  ,Daniel Blanc-Gonnet ,Vizille
Mémoire n°53,"Jean-Claude Gallotta , chorégraphe  ",Denis Bellon ,Isère
Mémoire n°53,A la découverte de l'art  ,Denis Bellon ,Pays vizillois
Mémoire n°53,Madame et Monsieur de Lesdiguières...  ,"Robert Aillaud ,  Patrice Dore ",Pays vizillois
Mémoire n°53,Complément à l'histoire de la Chapelle des Angonnes  ,Pierre Coing Boyat ,Brié et Angonnes
Mémoire n°53,Olivier Messiaen à Petichet  ,Pierre Coing Boyat ,Petichet
Mémoire n°53,"La musique à Vizille depuis 1873 -1ère partie : La fanfare de Vizille ou ""La Vizilloise"" - 1873/1982  ",Jeannette Della-Vedova ,Vizille
Mémoire n°53,Séraphin Guimet  ,Denis Bellon ,Vizille
Mémoire n°53,Les groupes musicaux  ,"Denis Bellon ,  Georges Martin ",Vizille
Mémoire n°53,L'art vivant - La danse : Jean-Claude Gallotta  ,Denis Bellon ,Isère
Mémoire n°53,L'art vivant - La danse : Jean-Claude Gallotta  ,Denis Bellon ,Pays vizillois
Mémoire n°53,L'art vivant - La danse : Jean-Claude Gallotta  ,Denis Bellon ,Vizille
Mémoire n°53,"Daise , Guy Desarmagnat  ",Denis Bellon ,Isère
Mémoire n°53,"Daise , Guy Desarmagnat  ",Denis Bellon ,Vizille
Mémoire n°53,L'art sur le plateau de Champagnier  ,Pierre Coing Boyat ,Champagnier
Mémoire n°53,Les tableaux restaurés de l'église de Saint Georges de Commiers  ,"Jacques Gasqui ,  Marc Masimbert ",Saint Georges de Commiers
Mémoire n°53,L'église Saint-Blaise à Champ sur Drac  ,Gilbert Gacon ,Champ sur Drac
Mémoire n°53,Enquête sur les tribulations d'un meuble d'église  ,Michel Merlin ,Jarrie
Mémoire n°53,Un regard artistique sur le patrimoine industriel local par L'Artelier d'Uriage  ,André Rossi ,Pays vizillois
Mémoire n°53,Un regard artistique sur le patrimoine industriel local par L'Artelier d'Uriage  ,André Rossi ,Uriage
Mémoire n°53,L'Ecole Nationale Professionnelle de jeunes filles de Vizille - l'ENP  ,Pierre Fiat ,Vizille
Mémoire n°53,La BD Jojo de la Gaffe  ,Georges Martin ,Vizille
Mémoire n°53,Les portes du Château de Vizille  ,Pierre Fiat ,Vizille
Mémoire n°53,Uriage : la fontaine de la déesse Hygie  ,Denis Bellon ,Uriage
Mémoire n°53,La première foire de Champagnier en 1758  ,Pierre Fiat ,Champagnier
Mémoire n°53,La Grande Guerre de 1914-1918 : Vizille et ses soldats décédés entre le 1er juillet et le31 décembre 1917  ,Marie-Claude Argoud ,Vizille
Mémoire n°53,Une page de l'histoire se tourne...L'hôpital-hospice  ,Marie-Claude Argoud ,Vizille
Mémoire n°53,Vizille et ses commerces : Place de la Libération - 4ème partie  ,Jeannette Della-Vedova ,Vizille
Mémoire n°54,Adrienne Celso  ,Pierre Coing Boyat ,Champ sur Drac
Mémoire n°54,Les retours et la reconstruction  ,Denis Bellon ,Vizille
Mémoire n°54,Le général Regard de la Grande Guerre à la Résistance  ,Jacques Gasqui ,Grenoble
Mémoire n°54,Le général Regard de la Grande Guerre à la Résistance  ,Jacques Gasqui ,Isère
Mémoire n°54,Le général Regard de la Grande Guerre à la Résistance  ,Jacques Gasqui ,Saint Georges de Commiers
Mémoire n°54,"Centenaire de la mort de Serge Basset, homme de lettres, auteur dramatique et journaliste français  ",Charles Paillet ,Grenoble
Mémoire n°54,"Centenaire de la mort de Serge Basset, homme de lettres, auteur dramatique et journaliste français  ",Charles Paillet ,Uriage
Mémoire n°54,Victor Chambe 1896-1965  ,Jeannette Della-Vedova ,Vizille
Mémoire n°54,Une famille qui a failli disparaître dans la tourmente de la pere guerre mondiale  ,"Jacques Gasqui , Marc Masimbert ",Vizille
Mémoire n°54,Les cérémonies du souvenir en Days Vizillois  ,Denis Bellon ,Vizille
Mémoire n°54,Les soldats de Brié-et-Angonnes décédés durant le conflit…  ,Marie-Claude Argoud ,Brié et Angonnes
Mémoire n°54,La grande guerre de 1914-1918 Vizille et ses soldats décédés entre le 1*' janvier et le 30 juin 1918  ,Marie-Claude Argoud ,Vizille
Mémoire n°54,L'épopée du ski jarrois - père partie - 1947/1968  ,Claudie Picot ,Jarrie
Mémoire n°54,De la Vizilloise à l'Harmonie de Vizille - 2° partie - 1983-2017  ,Jeannette Della-Vedova ,Vizille
Mémoire n°55,Sommaire  ,Collectif - les Amis de l'Histoire ,Pays vizillois
Mémoire n°55,•« Plus jamais ça ! »  ,Denis Bellon ,Pays vizillois
Mémoire n°55,• L'hirondelle de Vizille  ,Denis Bellon ,Isère
Mémoire n°55,• L'hirondelle de Vizille  ,Denis Bellon ,Pays vizillois
Mémoire n°55,La pisciculture du Château de Vizile  ,Danielle Amar ,Vizille
Mémoire n°55,"Une vie au... Parc des Princes ; La ferme prince à FontReygner, hameau de Saint jean de Vaux  ",Denis Bellon ,Saint Jean de Vaux
Mémoire n°55,"Une vie au... Parc des Princes ; La ferme prince à FontReygner, hameau de Saint jean de Vaux  ",Denis Bellon ,Vizille
Mémoire n°55,Le général Auguste Lardant soldat des troupes de montagne ,Jacques Gasqui ,Isère
Mémoire n°55,Le général Auguste Lardant soldat des troupes de montagne ,Jacques Gasqui ,Saint Georges de Commiers
Mémoire n°55,L'été 1944 au Péage-de-Vizile André raconte  ,André Finet ,Pays vizillois
Mémoire n°55,L'été 1944 au Péage-de-Vizile André raconte  ,André Finet ,Vizille
Mémoire n°55,Les femmes dans la guerre de 1914 à 1918  ,Marie-Claude Argoud ,Pays vizillois
Mémoire n°55,Les femmes dans la guerre de 1914 à 1918  ,Marie-Claude Argoud ,Vizille
Mémoire n°55,Joseph et François Baldacci  ,Jeannette Della-Vedova ,Pays vizillois
Mémoire n°55,Joseph et François Baldacci  ,Jeannette Della-Vedova ,Vizille
Mémoire n°55,La grande guerre de 1914-1918 Viille et ses soldats décédés entre le 1* juillet et le 31 décembre 1918  ,Marie-Claude Argoud ,Vizille
Mémoire n°55,Les anciennes routes du Pays Vizilois  ,Pierre Fiat ,Pays vizillois
Mémoire n°55,Les anciennes routes du Pays Vizilois  ,Pierre Fiat ,Uriage
Mémoire n°55,Les anciennes routes du Pays Vizilois  ,Pierre Fiat ,Vizille
Mémoire n°55,• L'épopée du ski jarrois - 2° partie - 1969/2017  ,Claudie Picot ,Jarrie
Mémoire n°55,•La « Samba Parade » de 2006 à Vizille  ,"Jeannette Della-Vedova ,  Jean Danz ",Vizille
Mémoire n°55,Les soldats de Saint-Barthélémy-de-Séchilienne décédés durant la Grande Guerre  ,Marie-Claude Argoud ,Saint Barthélémy de Séchilienne
Mémoire n°55,• Un passé bien antérieur ! Coupe de bois à Jarrie en 1743 ,Pierre Coing Boyat ,Jarrie
Mémoire n°55,Moi collectionneur  ,Marc Robert ,Vizille
Mémoire n°55,Une liqueur oubliée La «Benoîte d'Uriage »  ,Pierre Fiat ,Uriage
Mémoire n°55,Une liqueur oubliée La «Benoîte d'Uriage »  ,Pierre Fiat ,Vizille
Mémoire n°56,L'esprit de Résistance  ,Denis Bellon ,Isère
Mémoire n°56,L'esprit de Résistance  ,Denis Bellon ,Pays vizillois
Mémoire n°56,L'esprit de Résistance  ,Denis Bellon ,L'Oisans
Mémoire n°56,Germaine et Louis Vallier Résistants  ,Dominique Rossi ,Pays vizillois
Mémoire n°56,Germaine et Louis Vallier Résistants  ,Dominique Rossi ,Vizille
Mémoire n°56,Jean-Marcel Champon Résistant  ,Dominique Rossi ,Vizille
Mémoire n°56,/Users/michelt/Pictures/Photothèque.photoslibrary/originals/0/02DF1CB0-B94D-4170-A15F-41A54515EAB3.png  ,Dominique Rossi ,Vizille
Mémoire n°56,Parcours d'un Résistant sans frontière Ces étrangers qui ont fait la France (Dominique Rossi)  ,Dominique Rossi ,Vizille
Mémoire n°56,La famille Marangoni - Une triste histoire ()  ,Jeannette Della-Vedova ,Vizille
Mémoire n°56,Renée et André Berthon se souviennent ()  ,Jeannette Della-Vedova ,Vizille
Mémoire n°56,L'équipage américain du B24 - Libérator ()  ,Pierre Lafaverges ,L'Oisans
Mémoire n°56,L'équipage américain du B24 - Libérator ()  ,Pierre Lafaverges ,L'Alpe d'Huez
Mémoire n°56,Huez et l'Alpe - Été 1944 ()  ,Gilbert ORCEL ,L'Alpe d'Huez
Mémoire n°56,Des représentations d'animaux dans le Pays Vizillois ()  ,Annie Achard ,Pays vizillois
Mémoire n°56,Des représentations d'animaux dans le Pays Vizillois ()  ,Annie Achard ,Vizille
Mémoire n°56,Catalogue 2019  ,- ,Vizille
Mémoire n°56,D'où vient le mot Jarrie et que veut-il dire ? ()  ,Pierre Coing Boyat ,Jarrie
Mémoire n°56,Des Vizillois oubliés ()  ,Pierre Fiat ,Vizille
Mémoire n°56,Le train de la Romanche ()  ,Jean-Louis Philip ,Pays vizillois
Mémoire n°56,Le train de la Romanche ()  ,Jean-Louis Philip ,Vizille
Mémoire n°56,Herbeys - Chemins d'hier et d'aujourd'hui ()  ,Danièle Prud'homme ,Herbeys
Mémoire n°56,Un espace culturel Paul Bernard à Jarrie ()  ,Denis Bellon ,Champagnier
Mémoire n°56,Un espace culturel Paul Bernard à Jarrie ()  ,Denis Bellon ,Jarrie
Mémoire n°56,Un espace culturel Paul Bernard à Jarrie ()  ,Denis Bellon ,Pays vizillois
Mémoire n°56,Un espace culturel Paul Bernard à Jarrie ()  ,Denis Bellon ,Vizille
Mémoire n°57,Éditorial  ,Denis Bellon ,Pays vizillois
Mémoire n°57,14 septembre 1219: les jours d'après à Vizille  ,Georges Martin ,Pays vizillois
Mémoire n°57,14 septembre 1219: les jours d'après à Vizille  ,Georges Martin ,Vizille
Mémoire n°57,Les paléo-lacs d'Oisans - Une histoire de 30 000 ans  ,Marie-Christine Bailly-Maitre - ,L'Oisans
Mémoire n°57,Histoire d'eau à Saint-Georges-de-Commiers  ,Jacques Gasqui ,Saint Georges de Commiers
Mémoire n°57,Le lavoir de la Paute  ,Denis Bellon ,Vizille
Mémoire n°57,L'épisode de « la noyade » de Vizille  ,Pascale Beyls ,Vizille
Mémoire n°57,Le Lac de Haute-Jarrie et les sècheresses  ,Pierre Coing Boyat ,Jarrie
Mémoire n°57,Les ressources en eau de la commune de Saint-Pierre-de-Mésage  ,Jean-Claude Vayr ,Saint Pierre de Mésage
Mémoire n°57,Les ressources en eau de la commune de Saint-Pierre-de-Mésage  ,Jean-Claude Vayr ,Saint Pierre de Mésage
Mémoire n°57,La foire de Beaucroissant  ,Denis Bellon ,Isère
Mémoire n°57,Un monument historique classé en DANGER : Le prieuré de Vizille  ,Collectif - les Amis de l'Histoire ,Vizille
Mémoire n°57,A propos de la mutilation des personnages  ,Collectif - les Amis de l'Histoire ,Vizille
Mémoire n°57,La page du poète. Le cimetière de Vizille  ,- ,Vizille
Mémoire n°57,Premières écoles vizilloises  ,Denis Bellon ,Vizille
Mémoire n°57,Essai de toponymie de l'appellation Belledonne  ,Raymond Joffre ,Belledonne
Mémoire n°57,Les fossiles de Vaulnaveys-le-Bas  ,Bruno Vallois ,Vaulnaveys le bas
Mémoire n°57,Quand les élèves s'emparent de l'histoire  ,- ,Saint Pierre de Mésage
Mémoire n°57,Quand les élèves s'emparent de l'histoire  ,"Axelle Burnet ,  Stéphane Callot ",Saint Pierre de Mésage
Mémoire n°57,Souvenirs de guerre (39/45) d'un écolier vizillois  ,Jean Huyghe ,Pays vizillois
Mémoire n°57,Souvenirs de guerre (39/45) d'un écolier vizillois  ,Jean Huyghe ,Vizille
Mémoire n°57,Des représentations d'animaux dans le pays vizillois (2ème partie)  ,Marie-Claude Argoud ,Pays vizillois
Mémoire n°58,Éditorial  ,Denis Bellon ,Pays vizillois
Mémoire n°58,La faille de Vizille  ,Thierry Grand ,Pays vizillois
Mémoire n°58,La faille de Vizille  ,Thierry Grand ,Vizille
Mémoire n°58,Première ascension hivernale du Taillefer  ,Raymond Joffre ,Isère
Mémoire n°58,De la pierre au ciment  ,Paul Girard ,Vizille
Mémoire n°58,La carrière oubliée  ,Georges Martin ,Notre Dame de Mésage
Mémoire n°58,La carrière oubliée  ,Georges Martin ,Pays vizillois
Mémoire n°58,L'usine électrique et la glacière à Vaulnaveys-le-Haut  ,Charles Paillet ,Uriage
Mémoire n°58,Débits de boissons à Saint-Pierre-de-Mésage  ,Gaby Vair ,Saint Pierre de Mésage
Mémoire n°58,Une figure pittoresque du Château de Paille dans les années 1950 « Kiki la rate »  ,Colette Expilly ,Vizille
Mémoire n°58,Vizille à travers la presse et les revues  ,"- ,  Jean Gonnet ",Vizille
Mémoire n°58,"je suis descendu de ma tribune, mais je vais revenir  ",Daniel Blanc-Gonnet ,Vizille
Mémoire n°58,Le Blanco  ,Denis Bellon ,Matheysine
Mémoire n°58,Le Blanco  ,Denis Bellon ,Pays vizillois
Mémoire n°58,Qu'est-ce qu'un zouave 7 (  ,Jean Caelen ,Pays vizillois
Mémoire n°58,Châteauneuf à Haute-Jarrie  ,Pierre Coing Boyat ,Jarrie
Mémoire n°58,"Résistance : Paul Reymond, un des derniers témoins  ",Dominique Rossi ,Vizille
Mémoire n°58,Le symbolisme au cimetière Les animaux (2ème partie) (  ,Marie-Claude Argoud ,Vizille
Mémoire n°58,Une très curieuse adoption apparaît dans un registre d'état civil de Jarrie  ,Pierre Coing Boyat ,Jarrie
Mémoire n°58,Une très curieuse adoption apparaît dans un registre d'état civil de Jarrie  ,Pierre Coing Boyat ,Vizille
Mémoire n°58,"L'eau, les canaux Lignes de vie de notre histoire  ",Marie-Claude Argoud ,Pays vizillois
Mémoire n°58,"L'eau, les canaux Lignes de vie de notre histoire  ",Marie-Claude Argoud ,Vizille
Mémoire n°58,Table des articles publiés dans Mémoire du n° 56 au n° 63 ,Collectif - les Amis de l'Histoire ,Pays vizillois
Mémoire n°58,Table des articles publiés dans Mémoire du n° 49 au n° 55 ,- ,Vizille
Mémoire n°59,éditorial  ,Denis Bellon ,Pays vizillois
Mémoire n°59,La fin du carreau minier de Saint-Georges-de-Commiers ,Jacques Gasqui ,Matheysine
Mémoire n°59,La fin du carreau minier de Saint-Georges-de-Commiers ,Jacques Gasqui ,Saint Georges de Commiers
Mémoire n°59,"Marius Bœuf (1898-1985), conducteur de trains sur le chemin de fer de La Mure  ",Fernand Boeuf ,Matheysine
Mémoire n°59,"Marius Bœuf (1898-1985), conducteur de trains sur le chemin de fer de La Mure  ",Fernand Boeuf ,Saint Georges de Commiers
Mémoire n°59,Souvenirs de la période 1939-1945 - Rencontre avec Fernand Bœuf  ,Jacques Gasqui ,Saint Georges de Commiers
Mémoire n°59,Les origines de Vizille  ,Quentin Jagadzinskil ,Pays vizillois
Mémoire n°59,Les origines de Vizille  ,Quentin Jagadzinskil ,Vizille
Mémoire n°59,"Vieille-Morte « Une histoire de roche, d'eau... et d'hommes » (  ",Nathalie Poiret ,Pays vizillois
Mémoire n°59,"Vieille-Morte « Une histoire de roche, d'eau... et d'hommes » (  ",Nathalie Poiret ,Bourg d'Oisans
Mémoire n°59,Le premier festival de Vizille en 1973 - Till l'espiègle  ,Jeannette Della-Vedova ,Vizille
Mémoire n°59,Le Manoir des Rolland  ,Pierre Coing Boyat ,Jarrie
Mémoire n°59,La peste en 1348 ..  ,Denis Bellon ,Jarrie
Mémoire n°59,La peste en 1348 ..  ,Denis Bellon ,Vizille
Mémoire n°59,Brèves de peste  ,Pierre Coing Boyat ,Pays vizillois
Mémoire n°59,Regards d'artistes  ,Henri Ondel ,Vizille
Mémoire n°59,« Marianne de profil » à l'Hôtel de Ville de Vizille  ,Denis Bellon ,Vizille
Mémoire n°59,Le tableau de l'Assemblée de Vizille par Alexandre Debelle  - ,Paul Girard ,Isère
Mémoire n°59,Le tableau de l'Assemblée de Vizille par Alexandre Debelle  - ,Paul Girard ,Vizille
Mémoire n°60,Éditorial  ,Denis Bellon ,Vizille
Mémoire n°60,Le retour de Lucie Baud  ,Michèle Perrot ,Vizille
Mémoire n°60,Un nouveau siège - De Notre-Dame de Mésage à Vizille ( ,Denis Bellon ,Vizille
Mémoire n°60,Quatre prix  ,Denis Bellon ,Vizille
Mémoire n°60,Quatre prix  ,Denis Bellon ,Vizille
Mémoire n°60,Les grands rendez-vous de l'histoire du Pays Vizillois ,Denis Bellon ,Vizille
Mémoire n°60,Les numéros spéciaux  ,Denis Bellon ,Vizille
Mémoire n°60,"Mémoire, la revue  ",Collectif - les Amis de l'Histoire ,Pays vizillois
Mémoire n°60,"Les assemblées générales, de Vizille à Champ-sur-Drac ",Jacques Gasqui ,Pays vizillois
Mémoire n°60,"Vizille, ville en transition  ",Denis Bellon ,Vizille
Mémoire n°60,Faisons chanter « l'orgue du Pays Vizillois »  ,Daniel Blanc-Gonnet ,Vizille
Mémoire n°60,S.O.S. Prieuré  ,"Pierrette Tournier ,  Nathalie Poiret ",Vizille
Mémoire n°60,"La mascarade passe, et lonlonlère...  ","- ,  Michèle Delahaye-Ferrafiat ",Vizille
Mémoire n°60,Les nouveaux outils de communication  ,Daniel Blanc-Gonnet ,Vizille
Mémoire n°60,Le patrimoine funéraire  ,Daniel Blanc-Gonnet ,Vizille
Mémoire n°60,"Saint-Roch, patron des épidémies (suite)  ",Monique Bonvallet ,Pays vizillois
Mémoire n°60,Histoire de Haute-Jarrie et de la famille Teyssier de Savy (suite)  ,Pierre Coing Boyat ,Jarrie
Mémoire n°61,Éditorial  ,Denis Bellon ,Laffrey
Mémoire n°61,Éditorial  ,Denis Bellon ,Vizille
Mémoire n°61,"L'épopée de Napoléon, d'une île à l'autre  ",Patrick Laudet ,Laffrey
Mémoire n°61,"L'épopée de Napoléon, d'une île à l'autre  ",Patrick Laudet ,Pays vizillois
Mémoire n°61,"L'épopée de Napoléon, d'une île à l'autre  ",Patrick Laudet ,Vizille
Mémoire n°61,"L'épopée de Napoléon, d'une île à l'autre  ",Patrick Laudet ,Brié
Mémoire n°61,Le destin de la statue équestre de l'empereur  ,Raymond Joffre ,Grenoble
Mémoire n°61,Le destin de la statue équestre de l'empereur  ,Raymond Joffre ,Laffrey
Mémoire n°61,Le destin de la statue équestre de l'empereur  ,Raymond Joffre ,Pays vizillois
Mémoire n°61,"Dominique Jean Larrey, chirurgien en chef de la Grande Armée  ","Denis Bellon ,  Jacques Gasqui ",Pays vizillois
Mémoire n°61,Napoléon et la réglementation minière - La loi du 21 avril 1810  ,Marie-Christine Bailly-Maitre - ,Pays vizillois
Mémoire n°61,La statue équestre de Napoléon à Laffrey  ,- ,Laffrey
Mémoire n°61,Les « Réfugiés Politiques Espagnols »  ,Carlos Vasquez-Marquénez ,Vizille
Mémoire n°61,La vie de deux adolescents dans la tourmente de la guerre (1939-1945) - Pierre Ruibet et Mathilde Robert  ,Albert Samuell ,Vizille
Mémoire n°61,Pierre Ruibet - Histoire complète  ,gérard Guétat ,Vizille
Mémoire n°61,Mistral gagnant à la Gaffe Vizille  ,"Cécile Mauvy (Vivarat) , Monique Canie ",Vizille
Mémoire n°61,La Pierre des rois  ,Interview ,Pays vizillois
Mémoire n°61,Souvenir de l'Occupation à Saint-Georges-de-Commiers (rencontre avec Jany Filhol)  ,"Jacques Gasqui , Interview ",Pays vizillois
Mémoire n°61,Souvenir de l'Occupation à Saint-Georges-de-Commiers (rencontre avec Jany Filhol)  ,"Jacques Gasqui , Interview ",Saint Georges de Commiers
Mémoire n°61,Qui était « Patte d'ours » et que nous raconte Alexandre Debelle ?  ,"- ,  Jean Vallon ",Vizille
Mémoire N°62,Éditorial  ,Denis Bellon ,Pays vizillois
Mémoire N°62,Première du Festival de Vizille  ,Louis Beyler ,Vizille
Mémoire N°62,Les festivals de Louis Beyler - 1976-La mère  ,Jeannette Della-Vedova ,Vizille
Mémoire N°62,"Paul Michel, photographe  ",Jean Huyghe ,Vizille
Mémoire N°62,"Paul Michel, photographe  ",Jean Huyghe ,Vizille
Mémoire N°62,"Paul Michel, photographe  ",Jean Huyghe ,Belledonne
Mémoire N°62,"Paul Michel, photographe  ",Jean Huyghe ,L'Oisans
Mémoire N°62,"Paul Michel, photographe  ",Jean Huyghe ,Massif de Belledonne
Mémoire N°62,"Paul Michel, photographe  ",Jean Huyghe ,Vizille
