Numéro,Titre,Auteur(s),Ville(s)
Mémoire n°22,La mort du maire de Vizille  ,Adrienne Celso ,Vizille
Mémoire n°23,II - Les moulins de Jarrie à travers l'histoire  ,Pierre Coing Boyat ,Jarrie
Mémoire n°23,Le renard et la cigogne  ,Albert Ravanat ,Pays vizillois
Mémoire n°23,Les sites du canton vous ouvrent leurs portes  ,Pierre Coing Boyat ,Pays vizillois
Mémoire n°23,La dolomite de St Pierre de Mésage  ,"Robert Aillaud ,  José Duarte ",Saint Pierre de Mésage
Mémoire n°23,VII - Les visites pastorales du cardinal Le Camus : la Matheysine (fin) ,Michel Vial ,Matheysine
Mémoire n°23,Le domaine Rabit à Herbeys  ,Marguerite Vianney-Liaud ,Herbeys
Mémoire n°23,Mondanité à Grenoble et Vizille - 1950  ,Gérard Mingat ,Vizille
Mémoire n°23,Histoire d'ours dans la montagne de Séchilienne  ,Bernard Mingone ,Séchilienne
Mémoire n°24,Nouvelles histoires d'ours  ,Bernard Mingone ,Séchilienne
Mémoire n°24,L'église de Brié  ,Henri Rey ,Brié et Angonnes
Mémoire n°24,Un mésageois à la découverte du monde  ,Germaine Billon ,Saint Pierre de Mésage
Mémoire n°24,Les bassins de Notre-Dame de Mésage  ,Aline Pignat ,Notre Dame de Mésage
Mémoire n°24,Dendrochronologie  ,Pierre Coing Boyat ,Pays vizillois
Mémoire n°24,St Sauveur souvenir de guerre  ,Roger Finet ,Notre Dame de Mésage
Mémoire n°24,Les premiers guides dauphinois sont de Belledonne  ,Raymond Joffre ,Pays vizillois
Mémoire n°24,III - Les moulins de Jarrie à travers l'histoire  ,Pierre Coing Boyat ,Jarrie
Mémoire n°25,"Les suites du spectacle""A la claire fontaine""  ",Robert Aillaud ,Pays vizillois
Mémoire n°25,IV - Les moulins de Jarrie à travers l'histoire  ,Pierre Coing Boyat ,Pays vizillois
Mémoire n°25,"""La Marianne"" : le monument commémoratif de l'assemble de Vizille  ",Robert Chagny ,Vizille
Mémoire n°25,II - L'annuaire d'un curé de campagne aux Angonnes  ,Pierre Melquiond ,Brié et Angonnes
Mémoire n°25,Montjean sur Vizille  ,Bernard Mingone ,Vizille
Mémoire n°26,Herbeys dans l'histoire - La complainte du kiosque  ,Le Kiosque ,Herbeys
Mémoire n°26,Les problèmes de la route des Hautes-Alpes  ,Pierre Coing Boyat ,Jarrie
Mémoire n°26,Histoire de cloche... à Vizille  ,Michel Vial ,Vizille
Mémoire n°26,Les mémoires de Basile Bonnardon  ,Robert Aillaud ,Pays vizillois
Mémoire n°26,Le temps des échafaudages  ,Robert Aillaud ,Pays vizillois
Mémoire n°26,V - Les moulins de Jarrie à travers l'histoire  ,Pierre Coing Boyat ,Pays vizillois
Mémoire n°26,A Brié... Des fontaines républicaines et radicales socialistes ,Pierre Melquiond ,Brié
Mémoire n°26,Autour de la légende du mmur du château de Vizille  ,Jean Guitton ,Vizille
Mémoire n°26,Un hôte de marque à Vizille : Jean Jaurès  ,"Gérard Mingat ,  Pierre Coing Boyat ",Vizille
Mémoire n°27,Assemblé générale des Amis de l'Histoire  ,Gaby Vair ,Montchaboud
Mémoire n°27,Contribution à l'histoire de la Libération de Vizille. Le 22 aout 1944  ,Jean Perrin ,Vizille
Mémoire n°27,Les 4 saisons de Léonce et Renée  ,Magali Roux ,Jarrie
Mémoire n°27,VI - Les moulins de Jarrie à travers l'histoire  ,Pierre Coing Boyat ,Jarrie
Mémoire n°27,Le patronnage Champ - Jarrie  ,Jeanette Cheveu D'or ,Champ sur Drac
Mémoire n°27,Le patronnage Champ - Jarrie  ,Jeanette Cheveu D'or ,Jarrie
Mémoire n°27,Fontaines et bassins de Vaulnaveys-le-Haut  ,"Jean Guitton ,  Renée Guitton ",Vaulnaveys le haut
Mémoire n°27,Le bureau de poste de Brié et Angonnes  ,Pierre Melquiond ,Brié et Angonnes
Mémoire n°27,Le service postal à Herbeys  ,Marie-Thérèse Emery ,Herbeys
Mémoire n°27,Mon premier poste d'institutrice  ,Aline Pignat ,Séchilienne
Mémoire n°28,Le saut du moine  ,"Michel Vial ,  Henri Jobert ",Jarrie
Mémoire n°28,La fonderie de la mine d'argent de Brandes en Oisans  ,Bernard François ,Brandes en Oisans
Mémoire n°28,Connaissance et actions du patrimoine  ,Patrice Dore ,Brié et Angonnes
Mémoire n°28,Le triste sort de Pierre Guymet-Node de Montchaffrey qui avait un peu trop fêté la St-Barthélémy 1805  ,"Gérard Mingat ,  Bernard Mingone ",Livet et Gavet
Mémoire n°28,Le triste sort de Pierre Guymet-Node de Montchaffrey qui avait un peu trop fêté la St-Barthélémy 1805  ,"Gérard Mingat ,  Bernard Mingone ",Montchaffrey
Mémoire n°28,Recherches sur la première église de Vizille  ,Jean-Claude Michel ,Vizille
Mémoire n°28,VII - Les moulins de Jarrie à travers l'histoire  ,Pierre Coing Boyat ,Jarrie
Mémoire n°28,L'hydroscope de Montjean  ,"Jean Guitton ,  Renée Guitton ",Montjean
Mémoire n°28,Commune de Livet et Gavet - Aout 1944  ,Alain Romestant ,Livet et Gavet
Mémoire n°28,Brié et Angonnes - La commune parraine le village martyr ardennais d'Etrepigny (1920) ,Pierre Melquiond ,Brié et Angonnes
Mémoire n°29,Souvenirs personnels de la libération de Vizille  ,Jean Guitton ,Vizille
Mémoire n°29,L'église de Séchilienne  ,Michel Vial ,Séchilienne
Mémoire n°29,Jarrie et ses montagnes  ,Jeanette Cheveu D'or ,Jarrie
Mémoire n°29,Ceux du magnésium  ,René Villiot ,Jarrie
Mémoire n°29,La Pauline  ,Denise - ,Vizille
Mémoire n°29,"Le chateau de paille : les habitants passent, le cadre reste  ",Peter Fletcher ,Vizille
Mémoire n°29,Lucis Baud (1870 - 1913)  ,Gérard Mingat ,Vizille
Mémoire n°30,Une journée festive et conviviale - 100 ans d'école à Vizille  ,- ,Vizille
Mémoire n°30,Un cas de rage à Vizille  ,Pascale Beyls ,Vizille
Mémoire n°30,Notre-Dame des Autels à Champ-sur-Drac  ,Michel Vial ,Champ sur Drac
Mémoire n°30,Le tourisme en Oisans  ,Raymond Joffre ,L'Oisans
Mémoire n°30,Visite du château de Vizille en 1628  ,Robert Aillaud ,Vizille
Mémoire n°30,Vizille et ses commerces - 1ère partie de la rue Général De Gaulle  ,- ,Vizille
Mémoire n°30,Quatre ans de retard pour la classe  ,- ,Vizille
Mémoire n°30,L'antiquité du plateau de Champagnier  ,Pierre Melquiond ,Champagnier
Mémoire n°31,Une famille au Bessey d'Oz au siècle dernier  ,Michelle Tournoud ,Bessey d'Oz
Mémoire n°31,"1790 : Dominique Bonnet, curé de St Pierre de Mésage, prête serment à la Constitution Civile du Clergé  ","Denis Chambaz ,  Pierre Coing Boyat ",Saint Pierre de Mésage
Mémoire n°31,Vizille et ses commerces : la place Stalingrad  ,Jeannette Della-Vedova ,Vizille
Mémoire n°31,100 ans d'école à Vizille - Encore des témoignages  ,Ecole Paul Langevin ,Vizille
Mémoire n°31,La Fayette à Vizille  ,Germaine Billon ,Vizille
Mémoire n°31,Un café peu ordinaire  ,Paul Wohlschlegel ,Rioupéroux
Mémoire n°31,Souvenirs au fil du temps : les usines de l'Alliance et du Tissage  ,Magali Roux ,Vizille
Mémoire n°31,"Commune de Livet et Gavet, aout 1944  ",Alain Romestant ,Livet et Gavet
Mémoire n°31,Un accident du train de la société des VFD  ,Gérard Mingat ,La Paute
Mémoire n°31,Un accident du train de la société des VFD  ,Gérard Mingat ,Bourg d'Oisans
Mémoire n°32,Femmes  ,- ,Herbeys
Mémoire n°32,Le tragique éboulement du 1er avril 1827 à Séchilienne  ,Bernard Mingone ,Séchilienne
Mémoire n°32,Etrange détour dans la destinée d'un pionnier de l'Alpe d'Huez  ,Roger Canac ,L'Alpe d'Huez
Mémoire n°32,Des nouvelles de 1903  ,Jean Perrier ,Grenoble
Mémoire n°32,Industries minières et métallurgiques tombées dans l'oubli à Vaulnaveys-le-Bas et à Uriage ,"B ? Bronner ,  Claude Bronner ",Uriage
Mémoire n°32,Industries minières et métallurgiques tombées dans l'oubli à Vaulnaveys-le-Bas et à Uriage ,"B ? Bronner ,  Claude Bronner ",Vaulnaveys le bas
Mémoire n°32,"L'électrification de Grenoble, un enjeu disputé  ",Alain Romestant ,Grenoble
Mémoire n°32,Vizille et ses commerces : un quartier dans la ville  ,Jeannette Della-Vedova ,Vizille
Mémoire n°32,A lire... ou à danser  ,- ,Pays vizillois
Mémoire n°32,100 ans d'école à Vizille - Encore des témoignages  ,Danielle Amar ,Vizille
Mémoire n°32,"Personnages et demeures de Jarrie, Bon Repos et la Valentine au temps des Vaucanson et Benoit Duperier  ",Pierre Coing Boyat ,Jarrie
Mémoire n°32,Ils auraient 100 ans cette année - classe 1927 de Vizille  ,Gérard Mingat ,Vizille
Mémoire n°33,Structure et histoire géologique du plateau de champagnier  ,Robert Aillaud ,Champagnier
Mémoire n°33,Géologie et contruction  ,Robert Aillaud ,Champagnier
Mémoire n°33,Des passionnés d'aviation  ,Alain Romestant ,Vizille
Mémoire n°33,Vizille et ses commerces : dernière partie de la rue Général de Gaulle  ,Jeannette Della-Vedova ,Vizille
Mémoire n°33,Année 1815 : le retour de Napoléon et son passage à Vizille  ,Gilbert Gacon ,Vizille
Mémoire n°33,Les aventures du capitaine Randon en marge du passage de Napoléon à Vizille ,Robert Aillaud ,Vizille
Mémoire n°33,Un vizillois Huguenot émigré en Prusse au XVIIe siècle  ,Gérard Mingat ,Vizille
Mémoire n°33,A propos du chevalier Bayard et du chateau d'Uriage  ,Geneviève Dumolard ,Uriage
Mémoire n°34,"Vizille : foires, marchés, quinzaines commerciales, braderies  ",Jeannette Della-Vedova ,Vizille
Mémoire n°34,Du chateau médiéval au palais du Connétable  ,Céline Laforest ,Vizille
Mémoire n°34,Le chateau de Vizille avant la Révolution Française  ,Céline Laforest ,Vizille
Mémoire n°34,Fresque de la façade de l'école Jean Jaurès  ,Yvette Bonnaire ,Vizille
Mémoire n°34,Quand la restauration d'objets du patrimoins provoque une cérémonie officielle de l'église catholique ,Patrice Dore ,Vizille
Mémoire n°34,La mine de zinc de Laffrey : une ruineuse chimère  ,Claude Bronner ,Laffrey
Mémoire n°34,L'incendie du village de Montchaffrey  ,Bernard Mingone ,Montchaffrey
Mémoire n°34,"Olivier Messiaen, l'un des plus grands musiciens du XXe siècle à Petichet  ",Pierre Coing Boyat ,Petichet
Mémoire n°34,1816 : le coup d'état manqué de Jean-Paul Didier  ,Gilbert Gacon ,Pays vizillois
Mémoire n°34,"Un peu de toponymie : chanse, chansure...  ",André Frances ,Pays vizillois
Mémoire n°34,Un triste mois de janvier à Brié : le meurtre du café restaurant Vigier  ,Pierre Melquiond ,Brié
Mémoire n°34,Les anciennes familles de Brié et Angonnes : la famille Ogier  ,Pierre Melquiond ,Brié et Angonnes
Mémoire n°35,"La ferme ""présidentielle"" du chateau de Vizille  ",Danielle Amar ,Vizille
Mémoire n°35,Promenade découverte à partir du saut du moine  ,Alain Romestant ,Champagnier
Mémoire n°35,Nos hommes de la révolutions  ,Pierre Melquiond ,Pays vizillois
Mémoire n°35,"Vizille et ses commerces - Les rues : Casimir. Périer, de la République, Sadi Carnot  ",Jeannette Della-Vedova ,Vizille
Mémoire n°35,I - Le parc du chateau du roi  ,Denis Bellon ,Vizille
Mémoire n°35,Le chateau des Simianes à Haute-Jarrie  ,Pierre Coing Boyat ,Jarrie
Mémoire n°35,"Souvenirs de Georges Vivier : un ""personnage"", une ""figure"" humaniste  ",Pierre Coing Boyat ,Jarrie
Mémoire n°36,Fermage à Chachatier en 1730  ,Bernard Mingone ,Vaulnaveys le bas
Mémoire n°36,Un courroux... magistral  ,Paul Kiener ,Vizille
Mémoire n°36,La méridienne du bar de la Paix  ,Denis Bellon ,Vizille
Mémoire n°36,Hercule de retour à Vizille  ,Robert Aillaud ,Vizille
Mémoire n°36,"Vizille, les maisons de l'abbé Pierre  ",Jeannette Della-Vedova ,Vizille
Mémoire n°36,Accident miraculeux à Huez  ,Michèle Bruyat ,L'Alpe d'Huez
Mémoire n°36,Barrage de l'Etroit... de l'eau qui a fait couler beaucoup d'encre!  ,Alain Romestant ,Pays vizillois
Mémoire n°36,"A Brié, elles aussi ont une histoire  ",Pierre Melquiond ,Brié
Mémoire n°36,Brié et ses environs en 1922 : promenade d'automne autour des 4 seigneurs  ,Pierre Melquiond ,Eybens
Mémoire n°36,Curiosités de nos archives communales - Jarrie  ,Pierre Coing Boyat ,Jarrie
Mémoire n°36,Eté 2009 - Patrimoine en fête  ,- ,Pays vizillois
Mémoire n°36,La desserte ferroviaire de la vallée de la Romanche  ,Jean-Louis Rochaix ,L'Oisans
Mémoire n°37,Le patrimoine vizillois  ,Robert Aillaud ,Pays vizillois
Mémoire n°37,Le patrimoine vizillois  ,Robert Aillaud ,Vizille
Mémoire n°37,Brié et ses environs en 1922 : promenade d'automne autour des 4 Seigneurs ,J. Vaujany ,Herbeys
Mémoire n°37,Canal de navigation ou chemin de fer entre Grenoble et Vizille - Rêves et réalité  ,Alain Romestant ,Vizille
Mémoire n°37,Vizille et ses commerces : La rue Aristide Briand (rue d'Italie)  ,Jeannette Della-Vedova ,Vizille
Mémoire n°37,II - Le parc du vieux château du roi  ,Denis Bellon ,Vizille
Mémoire n°37,Souvenirs d'enfance de Gavet au Poursollet  ,Annie Achard ,Livet et Gavet
Mémoire n°37,Centenaire des sapeurs-pompiers de Brié et Angonnes : 1909-2009  ,Paul Wohlschlegel ,Brié
Mémoire n°37,L'auto-école il y a 40 ans  ,Robert Guillaud ,Vizille
Mémoire n°37,La prise du château de Champ par Lesdiguières le 1er avril 1587  ,Robert Aillaud ,Champ sur Drac
Mémoire n°37,Une très jeune dame de 100 ans  ,Renée Gachet Berthon ,Vizille
Mémoire n°37,Le petit musée de la coiffure  ,Jeannette Della-Vedova ,Vizille
Mémoire n°37,Curiosités de nos archives communales - Les curés racontent l'histoire ,Pierre Coing Boyat ,Haute-Jarrie
Mémoire n°38,Adrienne  ,Robert Aillaud ,Jarrie
Mémoire n°38,La pierre plate à Rioupéroux  ,Annie Achard ,Rioupéroux
Mémoire n°38,Vizille et ses comerces : la boucherie Cret - 1908 à 1979 -1ère partie de la rue Jean Jaurès ,Jeannette Della-Vedova ,Vizille
Mémoire n°38,Vizille et ses commerces : La rue Aristide Briand (rue d'Italie) - 2ème partie  ,Jeannette Della-Vedova ,Vizille
Mémoire n°38,Brié et ses environs en 1922 : promenade d'automne autour des 4 Seigneurs  ,J. Vaujany ,Villeneuve d'Uriage
Mémoire n°38,Ou l'on retrouve les Hache ?  ,Pierre Melquiond ,Brié
Mémoire n°38,Une ténébreuse affaire : la conspiration Didier  ,Alain Romestant ,Pays vizillois
Mémoire n°38,L'histoire dans les archives - Le fonds Jouvin - Carnet du Sieur Corréard  ,Pierre Coing Boyat ,Jarrie
Mémoire n°38,L'alambic de la Gaffe  ,Renée Rodolphe Vigroux ,Vizille
Mémoire n°38,Le chateau de paille dans les années 50  ,Michèle Ferrafiat Delahaye ,Vizille
Mémoire n°38,Histoires d'eaux au château de Paille  ,Denis Bellon ,Vizille
Mémoire n°38,Ozias Féronce : un grand astronome vizillois méconnu  ,Robert Aillaud ,Vizille
Mémoire n°38,Attention... aux excès de vitesse !  ,Bernard Mingone ,Séchilienne
Mémoire n°39,Hommage à Pierre Melquiond  ,Robert Aillaud ,Brié et Angonnes
Mémoire n°39,Histoire de la Poste (1e partie) à Vizille  ,Paul Fournier ,Vizille
Mémoire n°39,Sur la route de Montchaffrey  ,Jeannette Della-Vedova ,Montchaffrey
Mémoire n°39,Le secret d'Hercule - Conte de Noël  ,Jeannette Della-Vedova ,Vizille
Mémoire n°39,Un ouvrage sur le château de Bon Repos  ,- ,Jarrie
Mémoire n°39,L'histoire dans les archives (suite)  ,Pierre Coing Boyat ,Jarrie
Mémoire n°39,L'authenticité éxigée par l'histoire  ,Pierre Melquiond ,Brié et Angonnes
Mémoire n°39,Emile Rivet  ,Germaine Billon ,Saint Pierre de Mésage
Mémoire n°39,Les cavalcades à Vizille (1e partie)  ,Danielle Amar ,Vizille
Mémoire n°39,"1310 - 2010, déjà 700 ans! Les libertés communales de Vizille  ",Denis Bellon ,Vizille
Mémoire n°39,Les chroniques oubliées : le contrat de mariage  ,Claude Ferradou ,Saint Pierre de Mésage
Mémoire n°39,Appel à recettes  ,Denis Bellon ,Pays vizillois
Mémoire n°41,Témoignage de Micheline Hauss  ,Micheline Hauss ,Vizille
Mémoire n°41,Tous à vos souvenirs ! Qui peut compléter cette grille ?  ,- ,Pays vizillois
Mémoire n°41,Les hommes de la conspiration Didier  ,Alain Romestant ,Pays vizillois
Mémoire n°41,Histoire de la Poste (2e partie)  ,Paul Fournier ,Vizille
Mémoire n°41,Les cavalcades à Vizille (2e partie)  ,Danielle Amar ,Vizille
Mémoire n°41,Les chroniques oubliées : le contrat de mariage  ,Claude Ferradou ,Saint Pierre de Mésage
Mémoire n°41,Historique de la maison Chamoux  ,? Chamoux ,Vizille
Mémoire n°41,Vizille et ses commerces : la rue Jean Jaurès (suite)  ,Jeannette Della-Vedova ,Vizille
Mémoire n°41,La tradition de Guignol à Uriage  ,Charles Paillet ,Uriage
Mémoire n°41,Notre-Dame-de-Jarrie  ,Pierre Coing Boyat ,Jarrie
Mémoire n°41,Berthe Vial  ,Yves Vial ,Vizille
Mémoire n°41,"Le fils d'Ozias Féronce, l'astronome vizillois  ",Robert Aillaud ,Vizille
Mémoire n°42,Le cimetière de Vizille  ,Daniel Blanc-Gonnet ,Vizille
Mémoire n°42,Le monument aux morts de Vizille  ,Denis Bellon ,Vizille
Mémoire n°42,"Les Jeux Olympiques modernes, une invention Grenobloise  ","Gérard Mingat ,  Alain Romestant ",Grenoble
Mémoire n°42,Repas de fête  ,Paul Wohlschlegel ,Vizille
Mémoire n°42,Notre-Dame-de-Jarrie (2e partie)  ,Pierre Coing Boyat ,Jarrie
Mémoire n°42,Le Lac Mort de Laffrey à Saint-Barthélémy-de-Séchilienne  ,Alain Romestant ,Séchilienne
Mémoire n°42,Mon premier travail...  ,Marie Del Net ,Vizille
Mémoire n°42,Curiosité  ,Paul Fournier ,Vizille
Mémoire n°42,Histoire de la Poste à Vizille (3e partie)  ,Paul Fournier ,Vizille
Mémoire n°42,Cavalcades organisées par le Comité du sou des écoles (3e partie)  ,Danielle Amar ,Vizille
Mémoire n°42,Mon enfance à Livet - Jeanne Fagno née Bergonzoli  ,Jeannette Della-Vedova ,Livet et Gavet
Mémoire n°42,La chapelle Notre-Dame-sous-la-Croix à Chamrousse  ,Charles Paillet ,Chamrousse
Mémoire n°42,Souvenirs d'enfance aux Peyrauds  ,Germaine Billon ,Saint Pierre de Mésage
Mémoire n°42,Parcours d'un Français libre  ,Gwénaëlle Leyssieux ,Vizille
Mémoire n°42,La vie de l'association  ,Denis Bellon ,Vizille
Mémoire n°43,Avis de recherche  ,- ,Vizille
Mémoire n°43,Les orgues historiques de Vizille  ,Denis Bellon ,Vizille
Mémoire n°43,La chapelle des Angonnes en 1867  ,Patrice Dore ,Vizille
Mémoire n°43,Histoire de la Reine de Mai ou le conte de l'Aspérule  ,Claude Ferradou ,Pays vizillois
Mémoire n°43,Les fêtes de Jarrie en 1867  ,Pierre Coing Boyat ,Jarrie
Mémoire n°43,"L'incroyable vie de Charles d'Albigny, seigneur de Séchilienne  ",Robert Aillaud ,Séchilienne
Mémoire n°43,L'oeuvre de Charles Albert Keller dans l'électrométallurgie et la production d'énergie électrique  ,Alain Romestant ,Livet et Gavet
Mémoire n°43,Nomination d'un garde champêtre à Vizille  ,Paul Fournier ,Vizille
Mémoire n°43,Les champignons  ,Jeannette Della-Vedova ,Vizille
Mémoire n°43,La société mycologique de Vizille  ,"Jeannette Della-Vedova ,  Jacques Boffo ",Vizille
Mémoire n°43,La tombe de la famille Du Terrail-Couvat dans l'ancien cimetière de Vizille  ,Daniel Blanc-Gonnet ,Vizille
Mémoire n°43,Les productions des Amis de l'Histoire du Pays Vizillois  ,- ,Pays vizillois
Mémoire n°43,Nos publications hors-séries  ,- ,Pays vizillois
Mémoire n°43,La vie de l'association  ,- ,Pays vizillois
Mémoire n°44,Michelle Perrot : sur les traces de Lucie Baud  ,Michèle Perrot ,Vizille
Mémoire n°44,Témoignage de Lucie Baud  ,Lucie Baud ,Vizille
Mémoire n°44,L'histoire de l'Alliance Textile  ,Denis Bellon ,Vizille
Mémoire n°44,Un carré de soie représentant le château de Vizille  ,Raymond Platel ,Vizille
Mémoire n°44,Une autre vision peu flatteuse de Vizille en 1882  ,Paul Fournier ,Vizille
Mémoire n°44,Une résistante vizilloise à l'honneur  ,Renée Gachet Berthon ,Vizille
Mémoire n°44,Adolphe Grimaldi  ,Gérard Mingat ,Vizille
Mémoire n°44,Parcs et jardins de Brié et Angonnes  ,Patrice Dore ,Brié et Angonnes
Mémoire n°44,"Champ-sur-Drac et son musée d'histoire locale ""Autrefois""  ",Gilbert Gacon ,Champ sur Drac
Mémoire n°44,Le moulin de Tavernolles  ,Paul Wohlschlegel ,Tavernolles
Mémoire n°44,La maison Allard au Louvaroux  ,Pierre Coing Boyat ,Jarrie
Mémoire n°44,Napoléon 1er à Tavernolles  ,Louis Sarte ,Tavernolles
Mémoire n°44,Reculement de la Grande Rue à Vizille en 1893  ,"Renée Gachet Berthon ,  Gérard Berthon ",Vizille
Mémoire n°44,Les gypsoducs de Champ au XVIIIe siècle  ,Robert Aillaud ,Champ sur Drac
Mémoire n°44,Le symbolisme dans le cimetière de Vizille  ,Daniel Blanc-Gonnet ,Vizille
Mémoire n°44,La vie de l'association  ,- ,Vizille
Mémoire n°45,Vous avez dit patrimoine ?  ,Denis Bellon ,Pays vizillois
Mémoire n°45,Bain de jouvence pour le château de Vizille  ,Paul Wohlschlegel ,Vizille
Mémoire n°45,"Lesdiguières, le renard des montagnes  ",Denis Bellon ,Vizille
Mémoire n°45,"Claudine de Bérenger et François de Bonne, duc de Lesdiguières ",Andrée Barras-Tixier ,Sassenage
Mémoire n°45,L'évêque de Grenoble se suicide dans son château d'Herbeys  ,Gilbert Gacon ,Herbeys
Mémoire n°45,Vous avez dit : lieux-dits ? Une histoire de toponymes  ,Paul Bernard ,Haute-Jarrie
Mémoire n°45,Le balancier et le bon Saint-Eloi  ,Patrice Dore ,Brié et Angonnes
Mémoire n°45,Les archives anciennes de Brié et Angonnes  ,Patrice Dore ,Brié et Angonnes
Mémoire n°45,Souvenir... souvenir... Les Jeux Olympiques de Grenoble en 1968 ,Henri Girardy ,Grenoble
Mémoire n°45,Une tentative d'incendie à Vizille  ,Pascale Beyls ,Vizille
Mémoire n°45,"L'association des ""Amis de l'orgue de Vizille"" est née  ",Denis Bellon ,Vizille
Mémoire n°45,Le refuge de la société des Touristes du Dauphiné à La Morte  ,Daniel Etienne ,La Morte
Mémoire n°45,Vizille et ses commerces : la rue Jean Jaurès (3ème et dernière partie) ,Jeannette Della-Vedova ,Vizille
Mémoire n°45,"Vizille, ville d'eau  ",Gérard Berthon ,Vizille
Mémoire n°45,La généalogie de Lucie Baud  ,Daniel Etienne ,Notre Dame de Mésage
Mémoire n°45,La généalogie de Lucie Baud  ,Daniel Etienne ,Saint Pierre de Mésage
Mémoire n°45,La maison d'Hugues-Allerme au Louvaroux  ,Pierre Coing Boyat ,Jarrie
Mémoire n°45,Le cimetière de Vizille  ,Pierre Raymond Bonnardon ,Vizille
Mémoire n°45,Le symbolisme dans le cimetière de Vizille (suite)  ,Daniel Blanc-Gonnet ,Vizille
Mémoire n°45,La vie de l'association  ,Collectif - les Amis de l'Histoire ,Pays vizillois
Mémoire n°46,Editorial  ,Denis Bellon ,Pays vizillois
Mémoire n°46,Jean Métral raconte  ,Jean Metral ,Vizille
Mémoire n°46,Les Etats Généraux de la Résistance à Vizille  ,Denis Bellon ,Vizille
Mémoire n°46,Circonstances du sauvetage et recherches  ,Jacqueline Szister-Bismuth ,Vizille
Mémoire n°46,La République des enfants de Moulin Vieux (1)  ,Denis Bellon ,La Morte
Mémoire n°46,Le stade René Perrouault à Champ-sur-Drac  ,Jacques Nivon ,Champ sur Drac
Mémoire n°46,Le sous-lieutenant Joseph Auguste Floxoli  ,Alain Floxoli ,Vizille
Mémoire n°46,Quelques heures avant la Libération  ,Cécile Riviere ,Vizille
Mémoire n°46,Une triste fin  ,Paul Wohlschlegel ,Rioupéroux
Mémoire n°46,Ils venaient d'avoir 18 ans... Les conscrits  ,Jeannette Della-Vedova ,Vizille
Mémoire n°46,Aout 1944 - Une période tragique à La Morte et dans le Taillefer  ,Daniel Etienne ,La Morte
Mémoire n°46,Chantiers de jeunesse n°12  ,Raymond Devey ,Belledonne
Mémoire n°47,"Albert Lebrun, le dernier Président de la IIIe République  ",Eric Freysselinard ,Vizille
Mémoire n°47,A travers la presse régionale et nationale  ,Collectif - les Amis de l'Histoire ,Vizille
Mémoire n°47,L'orgue de Vizille  ,Denis Bellon ,Vizille
Mémoire n°47,"Aimé Guille, portrait d'un résistant  ","Gilbert Gacon ,  Denis Bellon ",Vizille
Mémoire n°47,Yvonne Bonthoux et Jean-Marcel Champon  ,Dominique Rossi ,Vizille
Mémoire n°47,Ma rencontre avec Pierre Draï  ,Jeannette Della-Vedova ,Vizille
Mémoire n°47,Moulin-Vieux ou les enfants de la République  ,Pierre Draï ,La Morte
Mémoire n°47,Le château de Vizille efface les traces de ses blessures  ,- ,Vizille
Mémoire n°47,Groupes-francs contre les Forces de l'Ordre dans l'Isère  ,- ,Vizille
Mémoire n°47,"André Morel, mon voisin de palier  ",Alain Romestant ,Grenoble
Mémoire n°47,Morts pour la France dans le Pays Vizillois  ,Renée Vigroux ,Pays vizillois
Mémoire n°47,La grande guerre de 1914-1918 - Vizille et ses soldats décédés en 1914  ,Daniel Blanc-Gonnet ,Vizille
Mémoire n°47,La guerre 14/18 et l'utilisation des gaz de combat  ,Gilbert Gacon ,Claix
Mémoire n°47,La guerre 14/18 et l'utilisation des gaz de combat  ,Gilbert Gacon ,Jarrie
Mémoire n°47,Les belles années des corsos à Vizille - 1971/1997  ,Jeannette Della-Vedova ,Vizille
Mémoire n°47,La chasse aux bornes est ouverte...  ,Robert Aillaud ,Isère
Mémoire n°48,La statue de Napoléon 1er à Laffrey  ,Jeannette Della-Vedova ,Laffrey
Mémoire n°48,"Les mémoires de Basile Bonnardon, médecin à Vizille 1786-1863  ",Basile Bonnardon ,Pays vizillois
Mémoire n°48,Alexandre Debelle  ,Denis Bellon ,Grenoble
Mémoire n°48,"Alexandre Zeis, instituteur et géomètre  ",Gérard Mingat ,Vaulnaveys
Mémoire n°48,Le colonel Moustache de St-Barthélémy de Séchilienne  ,Gilles Strappazzon ,Saint Barthélémy de Séchilienne
Mémoire n°48,Vizille a toujours été fidèle à l'Empereur et à sa descendance  ,Paul Fournier ,Vizille
Mémoire n°48,La grande guerre de 1914-1918 - Vizille et ses soldats décédés entre le 1er janvier et le 30 juin 1915  ,"Daniel Blanc-Gonnet ,  Marie-Claude Argoud ",Vizille
